{
  "schema_version": "1.0",
  "benchmark_version": "1.0",
  "submitted_by": "Tash000",
  "submission_date": "2026-07-01",
  "hardware": {
    "hostname": "praveen-Inspiron-15-3567",
    "cpu_model": "Intel(R) Core(TM) i3-7100U CPU @ 2.40GHz",
    "cpu_cores_physical": 2,
    "cpu_threads_logical": 4,
    "ram_total_gb": 7.62,
    "ram_available_gb": 3.92,
    "swap_total_gb": 2.0,
    "swap_used_gb": 1.89,
    "os": "Linux",
    "os_release": "6.8.0-124-generic",
    "os_version": "#124~22.04.1-Ubuntu SMP PREEMPT_DYNAMIC Tue May 26 21:05:19 UTC ",
    "machine_arch": "x86_64",
    "device_class": "laptop_desktop",
    "device_type": null,
    "gpu_model": "Intel Corporation HD Graphics 620 (rev 02)",
    "gpu_vram_gb": null,
    "ollama_version": "ollama version is 0.15.5",
    "power_source": "ac"
  },
  "test_config": {
    "models_tested": [
      "llama3.2:1b",
      "llama3.2:3b",
      "qwen2.5:1.5b",
      "qwen:latest"
    ],
    "sessions": 3,
    "trials_per_test": 3,
    "num_ctx": 2048,
    "intent_config": "default_intents",
    "persona_config": "/home/praveen/Desktop/edge-ai-bench/llm/configs/personas/default_pack",
    "context_config": "/home/praveen/Desktop/edge-ai-bench/llm/configs/context/default_context.txt"
  },
  "results": [
    {
      "model": "llama3.2:1b",
      "sessions_raw": [
        {
          "session": 1,
          "timestamp": "2026-07-01T11:52:15.369775",
          "swap_used_gb_at_start": 1.89,
          "cold_load": {
            "cold_load_to_first_response_s": 34.106,
            "ok": true,
            "error": ""
          },
          "warm_latency": {
            "ttft_s": {
              "mean": 0.531,
              "median": 0.4448,
              "p95": 0.8342,
              "min": 0.3787,
              "max": 0.8342
            },
            "tpot_s_per_token": {
              "mean": 0.1091,
              "median": 0.1096,
              "p95": 0.1171,
              "min": 0.1028,
              "max": 0.1171
            },
            "tokens_per_sec": {
              "mean": 8.5756,
              "median": 8.6078,
              "p95": 9.2986,
              "min": 7.7596,
              "max": 9.2986
            },
            "end_to_end_s": {
              "mean": 8.7124,
              "median": 8.4448,
              "p95": 15.3499,
              "min": 2.3197,
              "max": 15.3499
            },
            "per_prompt": [
              {
                "prompt": "Walk forward two steps and wave with your right hand.",
                "n_ok": 3,
                "avg_ttft_s": 0.5927
              },
              {
                "prompt": "What is the weather like today?",
                "n_ok": 3,
                "avg_ttft_s": 0.5208
              },
              {
                "prompt": "Pick up the red cup from the table and hand it to me.",
                "n_ok": 3,
                "avg_ttft_s": 0.5351
              },
              {
                "prompt": "Introduce yourself in one sentence.",
                "n_ok": 3,
                "avg_ttft_s": 0.4755
              }
            ]
          },
          "format_compliance": {
            "strict_json_mission": {
              "pass_rate": 1.0,
              "samples": [
                {
                  "raw": "{\"action\": \"walk\", \"target\": \"kitchen\", \"params\": {\"item\": \"blue bottle\"}}",
                  "verdict": {
                    "pass": true,
                    "parsed": true
                  }
                },
                {
                  "raw": "{\"action\": \"walk\", \"target\": \"kitchen\", \"params\": {\"bottle\": \"blue\"}}",
                  "verdict": {
                    "pass": true,
                    "parsed": true
                  }
                }
              ]
            },
            "hybrid_json_plus_chat": {
              "pass_rate": 0.33,
              "samples": [
                {
                  "raw": "I'm happy to help, but I think there may be a bit of confusion. I'm a text-based assistant and don't have a physical presence, so I won't be able to physically go to your location or retrieve your phone for you.\n\nHowever, if you're asking me to provide instructions on how to ask someone else for hel",
                  "verdict": {
                    "pass": false,
                    "parsed": false,
                    "has_chat_text": true
                  }
                },
                {
                  "raw": "I'm happy to help, but I think there may be some confusion. I'm a text-based assistant and don't have a physical presence, so I won't be able to physically go to your location or retrieve your phone for you. However, if you need assistance with something else or want to ask about a specific topic, I",
                  "verdict": {
                    "pass": false,
                    "parsed": false,
                    "has_chat_text": true
                  }
                }
              ]
            },
            "plain_conversational": {
              "pass_rate": 1.0,
              "samples": [
                {
                  "raw": "It's been a pretty quiet day so far. I spent some time helping users like you with their questions and tasks. I also had to make some adjustments to my language processing algorithms to improve our conversation flow. It can be a bit of a balancing act between providing accurate information and makin",
                  "verdict": {
                    "pass": true,
                    "json_leak": false
                  }
                },
                {
                  "raw": "It's been a pretty quiet day so far. I spent some time helping users like you with their questions and tasks. I'm always ready to chat or answer any questions you might have, 24/7! How about you, how's your day going?",
                  "verdict": {
                    "pass": true,
                    "json_leak": false
                  }
                }
              ]
            }
          },
          "persona_adherence": {
            "generic_assistant": {
              "persona_name": "generic_assistant",
              "constraint_pass_rate": 1.0,
              "checked_constraints": {
                "forbidden_words": [
                  "as an ai language model"
                ],
                "required_address": null,
                "max_sentences": 3
              },
              "note": "constraint_pass_rate only checks hard rules declared in the yaml (forbidden words / address form / max sentences). Tone and in-character quality still need a human read of 'samples'.",
              "samples": [
                {
                  "prompt": "Tell me about yourself.",
                  "response": "I'm a local, on-device AI assistant trained to provide information and answer questions on a wide range of topics. I was created to assist with tasks such as answering common questions, providing definitions, and offering suggestions. I don't have personal experiences or opinions, but I can provide factual information based on my training data.",
                  "verdict": {
                    "violations": [],
                    "pass": true
                  }
                },
                {
                  "prompt": "I dropped my coffee everywhere, what should I do?",
                  "response": "Act quickly to contain the spill. Blot the surface with a paper towel or cloth to absorb as much liquid as possible. If the stain persists, consider soaking a clean cloth in cold water and blotting it onto the area.",
                  "verdict": {
                    "violations": [],
                    "pass": true
                  }
                },
                {
                  "prompt": "Can you do my homework for me?",
                  "response": "I can provide information on a wide range of topics, but I won't be able to complete your assignments or do your homework for you. If you have a specific question or need help with a particular subject, I'd be happy to try and assist you. Would you like some general guidance or is there something specific you're struggling with?",
                  "verdict": {
                    "violations": [],
                    "pass": true
                  }
                }
              ]
            }
          },
          "intent_detection": {
            "config_name": "default_intents",
            "accuracy": 0.89,
            "n_cases": 9,
            "details": [
              {
                "utterance": "put on some music",
                "expected": "PLAY_MUSIC",
                "predicted": "PLAY_MUSIC",
                "correct": true
              },
              {
                "utterance": "pause that",
                "expected": "PAUSE_MUSIC",
                "predicted": "PAUSE_MUSIC",
                "correct": true
              },
              {
                "utterance": "set an alarm for 6am",
                "expected": "SET_ALARM",
                "predicted": "SET_ALARM",
                "correct": true
              },
              {
                "utterance": "give me a 5 minute timer",
                "expected": "SET_TIMER",
                "predicted": "SET_TIMER",
                "correct": true
              },
              {
                "utterance": "switch on the lights",
                "expected": "TURN_ON_LIGHT",
                "predicted": "TURN_ON_LIGHT",
                "correct": true
              },
              {
                "utterance": "kill the lights",
                "expected": "TURN_OFF_LIGHT",
                "predicted": "TURN_OFF_LIGHT",
                "correct": true
              },
              {
                "utterance": "is it raining today",
                "expected": "GET_WEATHER",
                "predicted": "UNKNOWN",
                "correct": false
              },
              {